mysql> ALTER TABLE employee_payroll ADD gender CHAR(1) AFTER name;
Query OK, 0 rows affected (0.04 sec)
Records: 0  Duplicates: 0  Warnings: 0

mysql> describe employee_payroll;
+--------+--------------+------+-----+---------+----------------+
| Field  | Type         | Null | Key | Default | Extra          |
+--------+--------------+------+-----+---------+----------------+
| id     | int unsigned | NO   | PRI | NULL    | auto_increment |
| name   | varchar(150) | NO   |     | NULL    |                |
| gender | char(1)      | YES  |     | NULL    |                |
| salary | double       | NO   |     | NULL    |                |
| start  | date         | NO   |     | NULL    |                |
+--------+--------------+------+-----+---------+----------------+
5 rows in set (0.00 sec)

mysql> update employee_payroll set gender = 'M' where name = 'Santhosh' or name = 'Aravind';
Query OK, 2 rows affected (0.00 sec)
Rows matched: 2  Changed: 2  Warnings: 0

mysql> update employee_payroll set gender = 'F' where name = 'Namitha';
Query OK, 1 row affected (0.01 sec)
Rows matched: 1  Changed: 1  Warnings: 0

mysql> SELECT * FROM employee_payroll
    -> ;
+----+----------+--------+----------+------------+
| id | name     | gender | salary   | start      |
+----+----------+--------+----------+------------+
|  1 | Santhosh | M      | 10000000 | 2022-05-22 |
|  2 | Aravind  | M      | 10000000 | 2022-05-25 |
|  3 | Namitha  | F      | 10000000 | 2022-05-29 |
+----+----------+--------+----------+------------+
3 rows in set (0.00 sec)

mysql>